{
  "id": "7c1d2e3f-4a5b-4c6d-8e9f-0a1b2c3d4e5f",
  "sessionId": "3f1c2a4e-8b6d-4c1a-9e2f-1a2b3c4d5e6f",
  "participantId": "9a8b7c6d-5e4f-4a3b-2c1d-0e9f8a7b6c5d",
  "capability": "terminal_control",
  "audience": "host:pty-3f1c2a4e",
  "nonce": "b3f1a2c4d5e6f7089a1b2c3d4e5f6071",
  "expiresAt": "2026-07-16T09:12:00.000Z",
  "requiresStepUp": true
}
